{
  "all_have_safety_boundaries": true,
  "allow_user_facing_claims": false,
  "protocol_count": 3,
  "protocols": [
    {
      "id": "attentional_opacification",
      "label": "Attend to QRF variation",
      "model_intervention": {
        "metacognitive_access_delta": 0.25,
        "prior_precision_delta": -0.5
      },
      "paper_role": "progressive opacification of sigma",
      "safety_boundary": "Not therapeutic advice and not a claim of realization."
    },
    {
      "id": "dependent_origination_inquiry",
      "label": "Track condition-dependence of sector labels",
      "model_intervention": {
        "fixed_partition_weight_delta": -0.4,
        "sector_label_revisability": 0.5
      },
      "paper_role": "reveals boundary designation as contingent",
      "safety_boundary": "For reflective modeling only; stop if distressing."
    },
    {
      "id": "compassion_alignment",
      "label": "Expand policy scope without self-sector privilege",
      "model_intervention": {
        "compassion_scope_delta": 0.35,
        "self_privilege_weight_delta": -0.3
      },
      "paper_role": "unbounded free-energy minimization proxy",
      "safety_boundary": "Not a moral prescription or clinical protocol."
    }
  ],
  "schema": "realizing_emptiness.practice_protocol_map.v1"
}
